{"$id":"https://worldofhacks.org/sweep/schemas/observation-v1.schema.json","$schema":"https://json-schema.org/draft/2020-12/schema","additionalProperties":false,"properties":{"clock_mapping_id":{"anyOf":[{"maxLength":128,"minLength":1,"type":"string"},{"type":"null"}]},"confidence":{"maximum":1,"minimum":0,"type":"number"},"connection_epoch":{"maximum":9223372036854775807,"minimum":1,"type":"integer"},"device_id":{"maximum":2147483647,"minimum":1,"type":"integer"},"event_id":{"maxLength":128,"minLength":1,"type":"string"},"frame":{"maxLength":128,"minLength":1,"type":"string"},"node_type":{"enum":["aircraft","ground"]},"payload":{"oneOf":[{"additionalProperties":false,"properties":{"battery":{"maximum":1,"minimum":0,"type":"number"},"kind":{"const":"telemetry"},"link":{"maximum":1,"minimum":0,"type":"number"},"pos_quality":{"maximum":1,"minimum":0,"type":"number"},"position":{"additionalProperties":false,"properties":{"frame":{"maxLength":128,"minLength":1,"type":"string"},"x_m":{"maximum":1000000,"minimum":-1000000,"type":"number"},"y_m":{"maximum":1000000,"minimum":-1000000,"type":"number"},"z_m":{"maximum":1000000,"minimum":-1000000,"type":"number"}},"required":["frame","x_m","y_m","z_m"],"type":"object"},"state":{"maxLength":512,"minLength":1,"type":"string"},"velocity":{"additionalProperties":false,"properties":{"frame":{"maxLength":128,"minLength":1,"type":"string"},"x_m_s":{"maximum":1000000,"minimum":-1000000,"type":"number"},"y_m_s":{"maximum":1000000,"minimum":-1000000,"type":"number"},"z_m_s":{"maximum":1000000,"minimum":-1000000,"type":"number"}},"required":["frame","x_m_s","y_m_s","z_m_s"],"type":"object"}},"required":["kind","position","velocity","battery","link","pos_quality","state"],"type":"object"},{"additionalProperties":false,"properties":{"kind":{"const":"pose"},"pose":{"additionalProperties":false,"properties":{"child_frame":{"maxLength":128,"minLength":1,"type":"string"},"parent_frame":{"maxLength":128,"minLength":1,"type":"string"},"qw":{"maximum":1000000,"minimum":-1000000,"type":"number"},"qx":{"maximum":1000000,"minimum":-1000000,"type":"number"},"qy":{"maximum":1000000,"minimum":-1000000,"type":"number"},"qz":{"maximum":1000000,"minimum":-1000000,"type":"number"},"x_m":{"maximum":1000000,"minimum":-1000000,"type":"number"},"y_m":{"maximum":1000000,"minimum":-1000000,"type":"number"},"z_m":{"maximum":1000000,"minimum":-1000000,"type":"number"}},"required":["parent_frame","child_frame","x_m","y_m","z_m","qx","qy","qz","qw"],"type":"object"}},"required":["kind","pose"],"type":"object"},{"additionalProperties":false,"properties":{"angle_increment_rad":{"exclusiveMinimum":0,"maximum":1000000,"type":"number"},"angle_min_rad":{"maximum":1000000,"minimum":-1000000,"type":"number"},"kind":{"const":"range_scan"},"mount_id":{"maxLength":512,"minLength":1,"type":"string"},"range_max_m":{"exclusiveMinimum":0,"maximum":1000000,"type":"number"},"range_min_m":{"maximum":1000000,"minimum":0,"type":"number"},"ranges_m":{"items":{"anyOf":[{"type":"null"},{"maximum":1000000,"minimum":-1000000,"type":"number"}]},"maxItems":720,"minItems":1,"type":"array"},"sensor_pose":{"additionalProperties":false,"properties":{"child_frame":{"maxLength":128,"minLength":1,"type":"string"},"parent_frame":{"maxLength":128,"minLength":1,"type":"string"},"qw":{"maximum":1000000,"minimum":-1000000,"type":"number"},"qx":{"maximum":1000000,"minimum":-1000000,"type":"number"},"qy":{"maximum":1000000,"minimum":-1000000,"type":"number"},"qz":{"maximum":1000000,"minimum":-1000000,"type":"number"},"x_m":{"maximum":1000000,"minimum":-1000000,"type":"number"},"y_m":{"maximum":1000000,"minimum":-1000000,"type":"number"},"z_m":{"maximum":1000000,"minimum":-1000000,"type":"number"}},"required":["parent_frame","child_frame","x_m","y_m","z_m","qx","qy","qz","qw"],"type":"object"}},"required":["kind","sensor_pose","angle_min_rad","angle_increment_rad","range_min_m","range_max_m","ranges_m","mount_id"],"type":"object"},{"additionalProperties":false,"properties":{"calibration_id":{"maxLength":512,"minLength":1,"type":"string"},"height_px":{"maximum":16384,"minimum":1,"type":"integer"},"image_id":{"maxLength":512,"minLength":1,"type":"string"},"kind":{"const":"camera_frame"},"sha256":{"pattern":"^[0-9a-f]{64}$","type":"string"},"width_px":{"maximum":16384,"minimum":1,"type":"integer"}},"required":["kind","image_id","sha256","width_px","height_px","calibration_id"],"type":"object"},{"additionalProperties":false,"allOf":[{"else":{"properties":{"covariance_m2":{"type":"null"},"reason":{"enum":["ambiguous","unconfigured_tag","duplicate_tag","tag_too_small","reprojection_or_cheirality"]},"tag_pose":{"type":"null"}}},"if":{"properties":{"pose_accepted":{"const":true}}},"then":{"properties":{"reason":{"const":"pose"},"size_m":{"exclusiveMinimum":0,"maximum":1000000,"type":"number"},"tag_pose":{"additionalProperties":false,"properties":{"child_frame":{"maxLength":128,"minLength":1,"type":"string"},"parent_frame":{"maxLength":128,"minLength":1,"type":"string"},"qw":{"maximum":1000000,"minimum":-1000000,"type":"number"},"qx":{"maximum":1000000,"minimum":-1000000,"type":"number"},"qy":{"maximum":1000000,"minimum":-1000000,"type":"number"},"qz":{"maximum":1000000,"minimum":-1000000,"type":"number"},"x_m":{"maximum":1000000,"minimum":-1000000,"type":"number"},"y_m":{"maximum":1000000,"minimum":-1000000,"type":"number"},"z_m":{"maximum":1000000,"minimum":-1000000,"type":"number"}},"required":["parent_frame","child_frame","x_m","y_m","z_m","qx","qy","qz","qw"],"type":"object"}},"required":["tag_pose","reason","size_m"]}}],"properties":{"corners_px":{"items":{"items":{"maximum":16384,"minimum":-16384,"type":"number"},"maxItems":2,"minItems":2,"type":"array"},"maxItems":4,"minItems":4,"type":"array"},"covariance_m2":{"anyOf":[{"items":{"maximum":1000000,"minimum":-1000000,"type":"number"},"maxItems":9,"minItems":9,"type":"array"},{"type":"null"}]},"family":{"const":"tag36h11"},"image_id":{"maxLength":512,"minLength":1,"type":"string"},"kind":{"const":"tag_observation"},"pixel_frame":{"enum":["camera","rectified_camera"]},"pose_accepted":{"type":"boolean"},"reason":{"enum":["pose","ambiguous","unconfigured_tag","duplicate_tag","tag_too_small","reprojection_or_cheirality"]},"reprojection_rms_px":{"anyOf":[{"maximum":16384,"minimum":0,"type":"number"},{"type":"null"}]},"size_m":{"anyOf":[{"exclusiveMinimum":0,"maximum":1000000,"type":"number"},{"type":"null"}]},"tag_id":{"maximum":586,"minimum":0,"type":"integer"},"tag_pose":{"anyOf":[{"additionalProperties":false,"properties":{"child_frame":{"maxLength":128,"minLength":1,"type":"string"},"parent_frame":{"maxLength":128,"minLength":1,"type":"string"},"qw":{"maximum":1000000,"minimum":-1000000,"type":"number"},"qx":{"maximum":1000000,"minimum":-1000000,"type":"number"},"qy":{"maximum":1000000,"minimum":-1000000,"type":"number"},"qz":{"maximum":1000000,"minimum":-1000000,"type":"number"},"x_m":{"maximum":1000000,"minimum":-1000000,"type":"number"},"y_m":{"maximum":1000000,"minimum":-1000000,"type":"number"},"z_m":{"maximum":1000000,"minimum":-1000000,"type":"number"}},"required":["parent_frame","child_frame","x_m","y_m","z_m","qx","qy","qz","qw"],"type":"object"},{"type":"null"}]}},"required":["kind","family","tag_id","image_id","pose_accepted","tag_pose","covariance_m2","reason","size_m","corners_px","pixel_frame","reprojection_rms_px"],"type":"object"},{"additionalProperties":false,"properties":{"capabilities":{"items":{"maxLength":64,"minLength":1,"type":"string"},"maxItems":32,"type":"array"},"code":{"maxLength":512,"minLength":1,"type":"string"},"detail":{"maxLength":512,"minLength":1,"type":"string"},"kind":{"const":"status"}},"required":["kind","code","detail","capabilities"],"type":"object"}]},"session":{"maxLength":512,"minLength":1,"type":"string"},"source_id":{"maxLength":128,"minLength":1,"type":"string"},"t_capture":{"anyOf":[{"additionalProperties":false,"properties":{"clock_id":{"maxLength":512,"minLength":1,"type":"string"},"unit":{"enum":["ms","ns"]},"value":{"maximum":9223372036854775807,"minimum":0,"type":"integer"}},"required":["clock_id","unit","value"],"type":"object"},{"type":"null"}]},"t_ingest":{"maximum":9223372036854775807,"minimum":0,"type":"integer"},"t_source_receipt":{"additionalProperties":false,"properties":{"clock_id":{"maxLength":512,"minLength":1,"type":"string"},"unit":{"enum":["ms","ns"]},"value":{"maximum":9223372036854775807,"minimum":0,"type":"integer"}},"required":["clock_id","unit","value"],"type":"object"},"type":{"const":"observation"},"v":{"const":1}},"required":["v","type","event_id","session","device_id","connection_epoch","source_id","node_type","frame","confidence","t_capture","t_source_receipt","clock_mapping_id","payload","t_ingest"],"title":"Sweep observation event v1","type":"object","x-runtime-validation":{"canonical_utf8_max_bytes":65536,"text":"Python, TypeScript, and Kotlin parsers additionally require canonical printable text, capture <= source receipt on the same clock, equal telemetry envelope/vector frames, unit pose quaternions, range bounds, tag covariance symmetry and positive semidefiniteness, and source-bound frame/clock authorization."}}