{"clock_mapping_id":null,"confidence":0.6,"connection_epoch":3,"device_id":9,"event_id":"scan-001","frame":"lidar","node_type":"ground","payload":{"angle_increment_rad":0.1,"angle_min_rad":-0.1,"kind":"range_scan","mount_id":"ohmni-lidar-v1","range_max_m":8.0,"range_min_m":0.1,"ranges_m":[1.0,null,2.0],"sensor_pose":{"child_frame":"lidar","parent_frame":"odom","qw":1.0,"qx":0.0,"qy":0.0,"qz":0.0,"x_m":0.0,"y_m":0.0,"z_m":0.25}},"session":"demo-1","source_id":"ohmni-lidar","t_capture":null,"t_ingest":42,"t_source_receipt":{"clock_id":"ohmni-monotonic","unit":"ns","value":42000000},"type":"observation","v":1}
